{
  "$schema": "../../../schemas/task.schema.json",
  "id": "2026-08-27-phase1-demo",
  "title": "Implement Phase 1 WhatsApp AI receptionist demo",
  "status": "verification",
  "priority": "high",
  "created": "2026-08-27",
  "updated": "2026-09-08",
  "affectedModules": [
    "http",
    "conversation",
    "integrations",
    "persistence"
  ],
  "relatedRequirements": [
    "REQ-WA-001",
    "REQ-FAQ-001",
    "REQ-BOOK-001",
    "REQ-MEM-001",
    "REQ-CAL-001",
    "REQ-PAY-001",
    "REQ-HO-001",
    "REQ-DEPLOY-001",
    "REQ-AUTH-001",
    "REQ-PRES-001",
    "REQ-PRES-002",
    "REQ-PRES-003"
  ],
  "relatedBusinessRules": [
    "BR-DEMO-001",
    "BR-DEMO-002",
    "BR-CTA-001",
    "BR-ORA-001",
    "BR-AUTH-001",
    "BR-MED-001",
    "BR-BOOK-001",
    "BR-PAY-001",
    "BR-CANCEL-001",
    "BR-MEM-001"
  ],
  "relatedADRs": [
    "ADR-001",
    "ADR-002",
    "ADR-003"
  ]
}
